research_id,response_id,respondent_id,object,original_response,cleaned_response,translated_response,combined_response,final_response,originality_rater01,utility_rater01
CES201610,9821,607,paperclip,iets mee maken,,,use paperclip as ,use paperclip as ,1,3
CES201610,11300.2,710,paperclip, gebruiken voor ,,,use paperclip as ,use paperclip as ,0,0
CES201610,12086,767,paperclip,iets*,,,use paperclip as ,use paperclip as ,0,0
CES201610,12512,775,paperclip,gebruiken,,,use paperclip as ,use paperclip as ,0,0
CES201610,7561,494,paperclip,aambeien weghalen,aambeien weghalen,remove hemorrhoids,use paperclip as remove hemorrhoids,use paperclip as remove hemorrhoids,4,4
CES201610,8236,496,paperclip,administratie,administratie,administration,use paperclip as administration,use paperclip as administration,0,0
CES201610,12763,787,paperclip,afscheiding,afscheiding,secretion,use paperclip as secretion,use paperclip as secretion,2,2
CES201610,11763,724,paperclip,alle paperclips versmelten en tot iets anders maken,alle paperclips versmelten anders,all paperclips fuse differently,use paperclip as all paperclips fuse differently,use paperclip as all paperclips fuse differently,3,3
CES201610,8160,490,paperclip,aluminium,aluminium,aluminium,use paperclip as aluminium,use paperclip as aluminium,0,0
CES201610,8602,535,paperclip,een ander object aan een papiertje vastklemmen ,ander object papiertje vastklemmen,clamp another object onto paper,use paperclip as clamp another object onto paper,use paperclip as clamp another object onto paper,1,5
CES201610,8291,505,paperclip,iets anders dan papier bij elkaar houden bijv. kleding,anders papier elkaar houden oorbeeld kleding,other paper hold together example clothes,use paperclip as other paper hold together example clothes,use paperclip as other paper hold together example clothes,2,4
CES201610,10986,679,paperclip,animatie voor microsoft van maken,animatie Microsoft,animation Microsoft,use paperclip as animation Microsoft,use paperclip as animation Microsoft,0,0
CES201610,8940,572,paperclip,appelhouder,appelhouder,apple holder,use paperclip as apple holder,use paperclip as apple holder,4,3
CES201610,8306,554,paperclip,arbeit,arbeit,labor,use paperclip as labor,use paperclip as labor,0,0
CES201610,8058,542,paperclip,armband,armband,bracelet,use paperclip as bracelet,use paperclip as bracelet,3,4
CES201610,9096,565,paperclip,Armband maken,armband,bracelet,use paperclip as bracelet,use paperclip as bracelet,3,4
CES201610,9428,592,paperclip,armband van maken,armband,bracelet,use paperclip as bracelet,use paperclip as bracelet,3,4
CES201610,10233,625,paperclip,armband,armband,bracelet,use paperclip as bracelet,use paperclip as bracelet,3,4
CES201610,9938,638,paperclip,Armband,armband,bracelet,use paperclip as bracelet,use paperclip as bracelet,3,4
CES201610,11491,728,paperclip,armband,armband,bracelet,use paperclip as bracelet,use paperclip as bracelet,3,4
CES201610,12281,757,paperclip,armband maken,armband,bracelet,use paperclip as bracelet,use paperclip as bracelet,3,4
CES201610,11926,761,paperclip,armband,armband,bracelet,use paperclip as bracelet,use paperclip as bracelet,3,4
CES201610,12483,779,paperclip,armband,armband,bracelet,use paperclip as bracelet,use paperclip as bracelet,3,4
CES201610,8485,514,paperclip,armbandje,armbandje,bracelet,use paperclip as bracelet,use paperclip as bracelet,3,4
CES201610,10466,643,paperclip,armbandje,armbandje,bracelet,use paperclip as bracelet,use paperclip as bracelet,3,4
CES201610,12382,766,paperclip,armbandje (uitvouwbaar),armbandje,bracelet,use paperclip as bracelet,use paperclip as bracelet,4,4
CES201610,8298,554,paperclip,aufschreiben,aufschreiben,write down,use paperclip as write down,use paperclip as write down,0,0
CES201610,11842,752,paperclip,autovervorming speelgoedding,autovervorming speelgoed ding,car deformation toy thing,use paperclip as car deformation toy thing,use paperclip as car deformation toy thing,4,4
CES201610,9900,635,paperclip,baan,baan,track,use paperclip as track,use paperclip as track,0,0
CES201610,11389,716,paperclip,bakje,bakje,tub,use paperclip as tub,use paperclip as tub,0,0
CES201610,11226,701,paperclip,ballon leeg laten lopen,ballon leeg laten lopen,deflate balloon,use paperclip as deflate balloon,use paperclip as deflate balloon,2,5
CES201610,8432,511,paperclip,Ballon lekprikken,ballon lek prikken,puncture balloon,use paperclip as puncture balloon,use paperclip as puncture balloon,2,5
CES201610,11302,710,paperclip,balonnen bij elkaar,ballonnen elkaar,balloons together,use paperclip as balloons together,use paperclip as balloons together,2,5
CES201610,12604,785,paperclip,een banaan snijden van buitenaf,banaan snijden buitenaf,banana cutting outside,use paperclip as banana cutting outside,use paperclip as banana cutting outside,3,5
CES201610,12422,769,paperclip,de bandjes van je jurk aan je bh vastklemmen zodat deze niet afzakt ,bandjes jurk bh vastklemmen zodat niet afzakt,clamp straps of dress bra so that they do not fall,use paperclip as clamp straps of dress bra so that they do not fall,use paperclip as clamp straps of dress bra so that they do not fall,4,5
CES201610,11847,752,paperclip,bedel van kettinkje,bedel kettinkje,charm chain,use paperclip as charm chain,use paperclip as charm chain,3,4
CES201610,10593,652,paperclip,je behabandjes laten kruisen,behabandjes laten kruisen,cross bra straps,use paperclip as cross bra straps,use paperclip as cross bra straps,4,5
CES201610,10309,628,paperclip,iemand bekogelen,bekogelen,pelt,use paperclip as pelt,use paperclip as pelt,2,2
CES201610,9305,586,paperclip,op iets mee te bekrassen,bekrassen,scratch,use paperclip as scratch,use paperclip as scratch,2,4
CES201610,8941,572,paperclip,beloning,beloning,reward,use paperclip as reward,use paperclip as reward,2,3
CES201610,10928,673,paperclip,benodigdheden,benodigdheden,supplies,use paperclip as supplies,use paperclip as supplies,0,0
CES201610,8759,544,paperclip,beschadigen,beschadigen,damage,use paperclip as damage,use paperclip as damage,2,3
CES201610,11346,719,paperclip,bestek,bestek,cutlery,use paperclip as cutlery,use paperclip as cutlery,4,3
CES201610,11204,697,paperclip,Bewaakt de orde en rust,bewaakt orde rust,guard order and peace,use paperclip as guard order and peace,use paperclip as guard order and peace,0,0
CES201610,10888,670,paperclip,bh bandjes achter rug aan elkaar doen,bh bandjes achter rug elkaar,bra straps behind back,use paperclip as bra straps behind back,use paperclip as bra straps behind back,4,5
CES201610,8848,569,paperclip,Bh bandjes bij elkaar binden,bh bandjes elkaar binden,tie bra straps together,use paperclip as tie bra straps together,use paperclip to tie bra straps together,4,5
CES201610,7642,506,paperclip,bh bandjes bij elkaar houden,bh bandjes elkaar houden,bra straps hold together,use paperclip as bra straps hold together,use paperclip as bra straps hold together,4,5
CES201610,8764,544,paperclip,bh bandjes op je rug,bh bandjes rug,bra straps back,use paperclip as bra straps back,use paperclip as bra straps back,4,5
CES201610,7565,494,paperclip,een bierblikje open maken,bierblikje open,beer can open,use paperclip as beer can open,use paperclip as beer can open,4,3
CES201610,9626,611,paperclip,bieropener,bieropener,beer opener,use paperclip as beer opener,use paperclip as beer opener,4,3
CES201610,9485,595,paperclip,bijeenhouden,bijeenhouden,hold together,use paperclip as hold together,use paperclip as hold together,1,5
CES201610,11143,691,paperclip,binden,binden,tie,use paperclip as tie,use paperclip to tie,1,4
CES201610,9419,596,paperclip,binder,binder,binder,use paperclip as binder,use paperclip as binder,1,4
CES201610,9711,604,paperclip,binder,binder,binder,use paperclip as binder,use paperclip as binder,1,4
CES201610,9037,578,paperclip,bindertje voor andere dingen,binder dingen,bind things,use paperclip as bind things,use paperclip as bind things,1,4
CES201610,7639,506,paperclip,blaadje bijn ,blaadje bijeen,leaf together,use paperclip as leaf together,use paperclip as leaf together,1,5
CES201610,8969,575,paperclip,blaadjes bij elkaar,blaadjes elkaar,leaves together,use paperclip as leaves together,use paperclip as leaves together,1,5
CES201610,11930,749,paperclip,blaadjes aan elkaar doen,blaadjes elkaar,leaves together,use paperclip as leaves together,use paperclip as leaves together,1,5
CES201610,7643,506,paperclip,blaadjes bij elkaar houden,blaadjes elkaar houden,leaves hold together,use paperclip as leaves hold together,use paperclip as leaves hold together,1,5
CES201610,8430,511,paperclip,Blaadjes bij elkaar houden,blaadjes elkaar houden,leaves hold together,use paperclip as leaves hold together,use paperclip as leaves hold together,1,5
CES201610,8887,553,paperclip,blaadjes bij elkaar houden,blaadjes elkaar houden,leaves hold together,use paperclip as leaves hold together,use paperclip as leaves hold together,1,5
CES201610,10887,670,paperclip,blaadjes bij elkaar houden,blaadjes elkaar houden,leaves hold together,use paperclip as leaves hold together,use paperclip as leaves hold together,1,5
CES201610,11107,688,paperclip,blaadjes aan elkaar vast maken ,blaadjes elkaar vast,leaves stick together,use paperclip as leaves stick together,use paperclip as leaves stick together,1,5
CES201610,12269,754,paperclip,blaadjes samevoegen,blaadjes samenvoegen,join leaves together,use paperclip as join leaves together,use paperclip as join leaves together,1,5
CES201610,10039,616,paperclip,bladen,bladen,sheets,use paperclip as sheets,use paperclip as sheets,0,0
CES201610,8568,523,paperclip,bladwijzer,bladwijzer,bookmark,use paperclip as bookmark,use paperclip as bookmark,2,5
CES201610,10915,683,paperclip,bladwijzer,bladwijzer,bookmark,use paperclip as bookmark,use paperclip as bookmark,2,5
CES201610,11870,755,paperclip,bladwijzer,bladwijzer,bookmark,use paperclip as bookmark,use paperclip as bookmark,2,5
CES201610,8973,575,paperclip,bladzijde onthouden,bladzijde onthouden,remember page,use paperclip as remember page,use paperclip as remember page,2,5
CES201610,7463,485,paperclip,als bladzijdewijzer,bladzijdewijzer,pagemark,use paperclip as pagemark,use paperclip as pagemark,2,5
CES201610,9630,611,paperclip,blikjeshouden,blikjes houden,holding cans,use paperclip as holding cans,use paperclip as holding cans,3,3
CES201610,8305,554,paperclip,block,block,block,use paperclip as block,use paperclip as block,0,0
CES201610,12273,754,paperclip,bloemen recht laten groeien,bloemen recht laten groeien,grow flowers straight,use paperclip as grow flowers straight,use paperclip as grow flowers straight,5,5
CES201610,12059,746,paperclip,boat ,boat,boat,use paperclip as boat,use paperclip as boat,0,0
CES201610,10724,661,paperclip,boek,boek,book,use paperclip as book,use paperclip as book,0,0
CES201610,8558,520,paperclip,als boekenlegger gebruiken,boekenlegger,bookmark,use paperclip as bookmark,use paperclip as bookmark,2,5
CES201610,8889,553,paperclip,als boekenlegger gebruiken,boekenlegger,bookmark,use paperclip as bookmark,use paperclip as bookmark,2,5
CES201610,8953,556,paperclip,als boekenlegger gebruiken,boekenlegger,bookmark,use paperclip as bookmark,use paperclip as bookmark,2,5
CES201610,8974,575,paperclip,boekenlegger,boekenlegger,bookmark,use paperclip as bookmark,use paperclip as bookmark,2,5
CES201610,9417,596,paperclip,boekenlegger,boekenlegger,bookmark,use paperclip as bookmark,use paperclip as bookmark,2,5
CES201610,9758,626,paperclip,boekenlegger,boekenlegger,bookmark,use paperclip as bookmark,use paperclip as bookmark,2,5
CES201610,10468,643,paperclip,boekenlegger,boekenlegger,bookmark,use paperclip as bookmark,use paperclip as bookmark,2,5
CES201610,10767,677,paperclip,boekenlegger,boekenlegger,bookmark,use paperclip as bookmark,use paperclip as bookmark,2,5
CES201610,11844,752,paperclip,boekenlegger,boekenlegger,bookmark,use paperclip as bookmark,use paperclip as bookmark,2,5
CES201610,8993,562,paperclip,boekje,boekje,booklet,use paperclip as booklet,use paperclip as booklet,0,0
CES201610,11876,755,paperclip,om iets van te bouwen,bouwen,build,use paperclip as build,use paperclip as build,3,3
CES201610,9479,595,paperclip,breken,breken,break,use paperclip as break,use paperclip as break,2,3
CES201610,7373,473,paperclip,briefopener,briefopener,letter opener,use paperclip as letter opener,use paperclip as letter opener,3,4
CES201610,10916,683,paperclip,om broek mee dicht te houden,broek dicht houden,keep your pants closed,use paperclip as keep your pants closed,use paperclip as keep your pants closed,4,4
CES201610,7853,478,paperclip,om je broek iets draagbaarder te maken,broek draagbaarder,pants more wearable,use paperclip as pants more wearable,use paperclip as pants more wearable,4,4
CES201610,11753,743,paperclip,aan je broek hangen,broek hangen,pants hanging,use paperclip as pants hanging,use paperclip as pants hanging,4,4
CES201610,12150,770,paperclip,een broek sluiten ,broek sluiten,close pants,use paperclip as close pants,use paperclip as close pants,4,4
CES201610,8093,545,paperclip,broek vastmaken,broek vastmaken,fasten pants,use paperclip as fasten pants,use paperclip as fasten pants,4,4
CES201610,10308,628,paperclip,brood zakje dicht mee maken,brood zakje dicht,bread bag closed,use paperclip as bread bag closed,use paperclip as bread bag closed,3,5
CES201610,7604,497,paperclip,broodzakjes dichthoudt ding,broodzakjes dichthoudt ding,thing that keeps bread bags closed,use paperclip as thing that keeps bread bags closed,use paperclip as thing that keeps bread bags closed,3,5
CES201610,10314,628,paperclip,brug bouwen,brug bouwen,build bridge,use paperclip as build bridge,use paperclip as build bridge,4,2
CES201610,7718,512,paperclip,buigbaar,buigbaar,bendable,use paperclip as bendable,use paperclip as bendable,0,0
CES201610,7546,494,paperclip,buigen,buigen,bend,use paperclip as bend,use paperclip as bend,1,5
CES201610,7742,503,paperclip,BUIGEN,buigen,bend,use paperclip as bend,use paperclip as bend,1,5
CES201610,7746,503,paperclip,BUIGEN,buigen,bend,use paperclip as bend,use paperclip as bend,1,5
CES201610,7711,512,paperclip,buigen,buigen,bend,use paperclip as bend,use paperclip as bend,1,5
CES201610,8055,542,paperclip,buigen,buigen,bend,use paperclip as bend,use paperclip as bend,1,5
CES201610,8580,563,paperclip,buigen,buigen,bend,use paperclip as bend,use paperclip as bend,1,5
CES201610,9694,617,paperclip,buigen,buigen,bend,use paperclip as bend,use paperclip as bend,1,5
CES201610,10448,619,paperclip,buigen,buigen,bend,use paperclip as bend,use paperclip as bend,1,5
CES201610,11218,700,paperclip,buigen,buigen,bend,use paperclip as bend,use paperclip as bend,1,5
CES201610,11228,701,paperclip,buigen,buigen,bend,use paperclip as bend,use paperclip as bend,1,5
CES201610,11423,722,paperclip,buigen,buigen,bend,use paperclip as bend,use paperclip as bend,1,5
CES201610,12507,775,paperclip,buigen,buigen,bend,use paperclip as bend,use paperclip as bend,1,5
CES201610,12779,791,paperclip,buigen,buigen,bend,use paperclip as bend,use paperclip as bend,1,5
CES201610,10238,659,paperclip,buigen tot een figuurtje,buigen figuurtje,bend figure,use paperclip as bend figure,use paperclip as bend figure,3,5
CES201610,9898,635,paperclip,bureau,bureau,desk,use paperclip as desk,use paperclip as desk,0,0
CES201610,10925,673,paperclip,bureau,bureau,desk,use paperclip as desk,use paperclip as desk,0,0
CES201610,10290,622,paperclip,cadeau geven,cadeau geven,give present,use paperclip as give present,use paperclip as give present,3,4
CES201610,12423,769,paperclip,chipszak dichtmaken ,chips zak dichtmaken,close bag of chips,use paperclip as close bag of chips,use paperclip as close bag of chips,3,5
CES201610,8296,554,paperclip,Clip,clip,clip,use paperclip as clip,use paperclip as clip,1,5
CES201610,9269,587,paperclip,clip,clip,clip,use paperclip as clip,use paperclip as clip,1,5
CES201610,11832,727,paperclip,clip,clip,clip,use paperclip as clip,use paperclip as clip,1,5
CES201610,8297,554,paperclip,Clipboard,clipboard,clipboard,use paperclip as clipboard,use paperclip as clipboard,1,5
CES201610,7715,512,paperclip,klipje,clipje,clip,use paperclip as clip,use paperclip as clip,1,5
CES201610,9278,587,paperclip,clipje,clipje,clip,use paperclip as clip,use paperclip as clip,1,5
CES201610,11343,719,paperclip,klipje voor in haar,clipje haar,clip hair,use paperclip as clip hair,use paperclip as clip hair,3,4
CES201610,8395,508,paperclip,computer mee slopen,computer slopen,demolish computer,use paperclip as demolish computer,use paperclip as demolish computer,3,4
CES201610,8563,520,paperclip,om computerdraden bij elkaar te houden ze met een paperclip vastzetten,computerdraden elkaar houden paperclip vastzetten,computer wires hold together paper clip fasten,use paperclip as computer wires hold together paper clip fasten,use paperclip as computer wires hold together paper clip fasten,2,5
CES201610,11651,721,paperclip,computers,computers,computers,use paperclip as computers,use paperclip as computers,0,0
CES201610,11656,721,paperclip,computers,computers,computers,use paperclip as computers,use paperclip as computers,0,0
CES201610,8303,554,paperclip,Creativiteit,creativiteit,creativity,use paperclip as creativity,use paperclip as creativity,0,0
CES201610,7491,488,paperclip,decoratie,decoratie,decoration,use paperclip as decoration,use paperclip as decoration,3,3
CES201610,10231,625,paperclip,decoratie,decoratie,decoration,use paperclip as decoration,use paperclip as decoration,3,3
CES201610,12065,746,paperclip,decoration,decoration,decoration,use paperclip as decoration,use paperclip as decoration,3,3
CES201610,8310,554,paperclip,denken,denken,think,use paperclip as think,use paperclip as think,0,0
CES201610,7569,494,paperclip,designen,designen,designing,use paperclip as designing,use paperclip as designing,3,2
CES201610,10926,673,paperclip,desk,desk,desk,use paperclip as desk,use paperclip as desk,0,0
CES201610,10299,628,paperclip,deur open maken,deur open,door open,use paperclip as door open,use paperclip as door open,3,4
CES201610,11027,682,paperclip,deur mee open maken,deur open,door open,use paperclip as door open,use paperclip as door open,3,4
CES201610,8157,490,paperclip,deur openen,deur openen,open door,use paperclip as open door,use paperclip as open door,3,4
CES201610,8570,563,paperclip,deur openen,deur openen,open door,use paperclip as open door,use paperclip as open door,3,4
CES201610,10476,650,paperclip,om een deur mee te openen,deur openen,open door,use paperclip as open door,use paperclip as open door,3,2
CES201610,7791,521,paperclip,een deur openhouden,deur openhouden,keep door open,use paperclip as keep door open,use paperclip as keep door open,3,4
CES201610,10989,686,paperclip,deur openmaken,deur openmaken,open door,use paperclip as open door,use paperclip as open door,3,4
CES201610,12008,733,paperclip,deur openmaken,deur openmaken,open door,use paperclip as open door,use paperclip as open door,3,4
CES201610,12790,790,paperclip,deur openmaken,deur openmaken,open door,use paperclip as open door,use paperclip as open door,3,4
CES201610,8727,538,paperclip,deur die op slot zit open maken,deur slot zit open,door locked is open,use paperclip as door locked is open,use paperclip as door locked is open,3,4
CES201610,9301,586,paperclip,als deurstop,deurstopper,door stopper,use paperclip as door stopper,use paperclip as door stopper,4,2
CES201610,10968,676,paperclip,iets dicht maken idem,dicht idem,closed ditto,use paperclip as closed ditto,use paperclip as closed ditto,3,3
CES201610,10651,655,paperclip,als dichtmaker voor boterhamzakje,dichtmaker boterhamzakje,sandwich bag sealer,use paperclip as sandwich bag sealer,use paperclip as sandwich bag sealer,2,5
CES201610,8952,556,paperclip,dingen ermee bouwen,dingen bouwen,building things,use paperclip as building things,use paperclip as building things,3,3
CES201610,8263,499,paperclip,dingen dichtdoen door het om de opening heen te draaien,dingen dichtdoen opening heen draaien,"closing things, turning opening around","use paperclip as closing things, turning opening around","use paperclip as closing things, turning opening around",2,4
CES201610,9514,602,paperclip,Dingen aan elkaar maken ,dingen elkaar,things together,use paperclip as things together,use paperclip as things together,1,4
CES201610,7848,478,paperclip,dingen bij elkaar houden,dingen elkaar houden,things hold together,use paperclip as things hold together,use paperclip as things hold together,1,4
CES201610,8274,502,paperclip,dinegn bij elkaar houden,dingen elkaar houden,things hold together,use paperclip as things hold together,use paperclip as things hold together,1,4
CES201610,12118,739,paperclip,andere dingen bij elkaar houden,dingen elkaar houden,things hold together,use paperclip as things hold together,use paperclip as things hold together,1,4
CES201610,12362,763,paperclip,dingen bij elkaar houden,dingen elkaar houden,things hold together,use paperclip as things hold together,use paperclip as things hold together,1,4
CES201610,8954,556,paperclip,dingen aan elkaar vast maken,dingen elkaar vast,things stick together,use paperclip as things stick together,use paperclip as things stick together,1,4
CES201610,10657,658,paperclip,dingen aan elkaar vast maken,dingen elkaar vast,things stick together,use paperclip as things stick together,use paperclip as things stick together,1,4
CES201610,9415,596,paperclip,dingen aan elkaar vastmaken,dingen elkaar vastmaken,attaching things together,use paperclip as attaching things together,use paperclip as attaching things together,1,4
CES201610,11151,692,paperclip,andere dingen aan elkaar vastmaken,dingen elkaar vastmaken,attaching things together,use paperclip as attaching things together,use paperclip as attaching things together,1,4
CES201610,11317,713,paperclip,dingen onder je nagels weghalen,dingen onder nagels weghalen,removing things from under nails,use paperclip as removing things from under nails,use paperclip as removing things from under nails,3,5
CES201610,8971,575,paperclip,dingen ophangen,dingen ophangen,hanging things,use paperclip as hanging things,use paperclip as hanging things,2,4
CES201610,9260,583,paperclip,dingen mee ophangen,dingen ophangen,hanging things,use paperclip as hanging things,use paperclip as hanging things,2,4
CES201610,11318,713,paperclip,dingen aan ophangen,dingen ophangen,hanging things,use paperclip as hanging things,use paperclip as hanging things,2,4
CES201610,12741,788,paperclip,dingen ophangen,dingen ophangen,hanging things,use paperclip as hanging things,use paperclip as hanging things,2,4
CES201610,9592,608,paperclip,dingen oprapen,dingen oprapen,picking things up,use paperclip as picking things up,use paperclip as picking things up,3,3
CES201610,8261,499,paperclip,dingen resetten door de punt van de paperclip ergens in te steken,dingen resetten punt paperclip ergens steken,reset things point stick paperclip somewhere,use paperclip as reset things point stick paperclip somewhere,use paperclip to reset things point stick paperclip somewhere,3,5
CES201610,7787,521,paperclip,twee dingen spiezen,dingen spiezen,skewer things,use paperclip as skewer things,use paperclip as skewer things,2,4
CES201610,10585,649,paperclip,dingen spiezen,dingen spiesen,skewer things,use paperclip as skewer things,use paperclip as skewer things,2,4
CES201610,12099,742,paperclip,dingen aan vast maken,dingen vast,things fixed,use paperclip as things fixed,use paperclip as things fixed,1,4
CES201610,10568,668,paperclip,dingen mee vastmaken ,dingen vastmaken,fasten things,use paperclip as fasten things,use paperclip as fasten things,1,4
CES201610,10049,641,paperclip,dingen vastmaken aan elkaar,dingen vastmaken elkaar,things stick together,use paperclip as things stick together,use paperclip as things stick together,1,4
CES201610,8674,532,paperclip,dingetje om dingen mee weg te schrapen,dingetje dingen weg schrapen,thing things scraping away,use paperclip as thing things scraping away,use paperclip as thing things scraping away,3,4
CES201610,8535,560,paperclip,dingetjes lospeuteren,dingetjes lospeuteren,figure things out,use paperclip as figure things out,use paperclip as figure things out,3,4
CES201610,9273,587,paperclip,document,document,document,use paperclip as document,use paperclip as document,0,0
CES201610,8162,490,paperclip,documenten,documenten,documents,use paperclip as documents,use paperclip as documents,0,0
CES201610,12554,782,paperclip,documenten,documenten,documents,use paperclip as documents,use paperclip as documents,0,0
CES201610,7572,494,paperclip,doorboren van iets,doorboren,pierce,use paperclip as pierce,use paperclip as pierce,3,4
CES201610,9934,638,paperclip,Doorheen steken,doorheen steken,pass through,use paperclip as pass through,use paperclip as pass through,2,4
CES201610,7392,476,paperclip,iets doorprikken,doorprikken,puncture,use paperclip as puncture,use paperclip as puncture,2,4
CES201610,8758,544,paperclip,doorprikken,doorprikken,puncture,use paperclip as puncture,use paperclip as puncture,2,4
CES201610,11114,688,paperclip,doorslikken ,doorslikken,swallow,use paperclip as swallow,use paperclip as swallow,3,2
CES201610,10145,653,paperclip,doos,doos,box,use paperclip as box,use paperclip as box,0,0
CES201610,11652,721,paperclip,doosje,doosje,box,use paperclip as box,use paperclip as box,0,0
CES201610,8673,532,paperclip,dotting tool,dotting tool,dotting tool,use paperclip as dotting tool,use paperclip as dotting tool,4,5
CES201610,7714,512,paperclip,draad,draad,wire,use paperclip as wire,use paperclip as wire,2,3
CES201610,9422,596,paperclip,draad,draad,wire,use paperclip as wire,use paperclip as wire,2,3
CES201610,10140,653,paperclip,draad,draad,wire,use paperclip as wire,use paperclip as wire,2,3
