CES201606,870,20,belt,iets vastbinden,vastbinden,tie,use belt as tie,use belt to tie,2,4
CES201606,1646,42,belt,vastbinden,vastbinden,tie,use belt as tie,use belt to tie,2,4
CES201606,2131.2,51,belt, vastbinden trekken,vastbinden trekken,tie down pull,use belt as tie down pull,use belt to tie down pull,2,4
CES201606,1245,28,belt,iets vastmaken aan de riem,vastmaken riem,fasten belt,use belt as fasten belt,use belt as fasten belt,2,4
CES201606,1404,35,belt,iets ermee vastzetten,vastzetten,fasten,use belt as fasten,use belt as fasten,2,4
CES201606,1365,30,belt,veer,veer,feather,use belt as feather,use belt as feather,3,1
CES201606,768,19,belt,om te versieren,versieren,decorate,use belt as decorate,use belt to decorate,3,4
CES201606,1293,29,belt,versiersel,versiersel,decoration,use belt as decoration,use belt as decoration,3,4
CES201606,1945.1,47,belt,vroeger,vroeger,earlier,use belt as earlier,use belt as earlier,0,0
CES201606,268,13,belt,als wapen,wapen,weapon,use belt as weapon,use belt as weapon,2,5
CES201606,353,14,belt,als wapen (er iemand heul hard mee slaan),wapen,weapon,use belt as weapon,use belt as weapon,2,5
CES201606,1288,29,belt,wapen,wapen,weapon,use belt as weapon,use belt as weapon,2,5
CES201606,1527,38,belt,als wapen gebruiken,wapen,weapon,use belt as weapon,use belt as weapon,2,5
CES201606,582,17,belt,er weer een koe van maken,weer koe,cow again,use belt as cow again,use belt as cow again,0,0
CES201606,360,14,belt,iemand mee wurgen,wurgen,strangle,use belt as strangle,use belt as strangle,2,5
CES201606,663,18,belt,om iemand mee te wurgen ,wurgen,strangle,use belt as strangle,use belt as strangle,2,5
CES201606,1246,28,belt,iemand wurgen met een riem,wurgen riem,strangle belt,use belt as strangle belt,use belt as strangle belt,2,5
CES201606,2130.2,51,belt, zoals bundel hout,zoals bundel hout,such as bundle of wood,use belt as such as bundle of wood,use belt as such as bundle of wood,0,0
CES201606,1243,28,belt,mijn zus mee te spenken,zus spanken,sister spanking,use belt as sister spanking,use belt as sister spanking,2,5
CES201606,213,12,belt,zweep,zweep,whip,use belt as whip,use belt as whip,2,5
CES201606,434,15,belt,zweep,zweep,whip,use belt as whip,use belt as whip,2,5
CES201606,504,16,belt,zweep,zweep,whip,use belt as whip,use belt as whip,2,5
CES201606,987,23,belt,zweep,zweep,whip,use belt as whip,use belt as whip,2,5
CES201606,1110,25,belt,zweep,zweep,whip,use belt as whip,use belt as whip,2,5
CES201606,1206,27,belt,zweep,zweep,whip,use belt as whip,use belt as whip,2,5
CES201606,1495,37,belt,als zweep gebruiken,zweep,whip,use belt as whip,use belt as whip,2,5
CES201606,1695,43,belt,zweep,zweep,whip,use belt as whip,use belt as whip,2,5
CES201606,1800,45,belt,zweep,zweep,whip,use belt as whip,use belt as whip,2,5
CES201606,1878,46,belt,zweep,zweep,whip,use belt as whip,use belt as whip,2,5
